coordinated_product_name,pricing,product_number,category,image_urls,product_page_url,available_sizes,sense_of_the_sizes,breadcrumbs,product_title,product_generation_description,product_itemization_generation_descriptions,table_first_column_contents,table_all_row_contents,review_stars,review_titles,review_dates,review_descriptions,review_nicknames
アディカラー ウーブン ファイヤーバードトラックパンツ（ジャージ）,"16,500",IT2501,オリジナルス,"['https://shop.adidas.jp/photo/IT/IT2501/z-IT2501-on_model-standard_view-QdrpZFjzY1.jpg', 'https://shop.adidas.jp/photo/IT/IT2501/z-IT2501-on_model-back_view-jrqdgIqbjq.jpg', 'https://shop.adidas.jp/photo/IT/IT2501/z-IT2501-on_model-walking_view-HRS6xnAa2G.jpg', 'https://shop.adidas.jp/photo/IT/IT2501/z-IT2501-on_model-detail_view_1-gHKqmvOK4x.jpg', 'https://shop.adidas.jp/photo/IT/IT2501/z-IT2501-on_model-detail_view_2-B6CmZROYei.jpg']",https://shop.adidas.jp/products/IT2501/,"['XS', 'S', 'M', 'L', 'XL', '2XL', '3XL']",,"['メンズ', 'ウェア・服', 'ボトムス', 'ジャージ', 'オリジナルス', 'ファイヤーバード', 'アディカラー ウーブン ファイヤーバードトラックパンツ（ジャージ）']",裾に伸縮性を持たせた、フレッシュなシルエットのトラックパンツ。,クラシックなストリートスタイルに今風のディテールを添えた、アディダス トラックパンツ。出かけるときにも、家でくつろぐときにも活躍。ウーブンファブリックが、アイコニックなデザインにテーラード風のひねりを加えている。Tシャツやスニーカーと合わせればくつろぎ感のあるスタイルに、またはタイムレスなボンバージャケットと組み合わせればコーディネートを格上げできる。,"['レギュラーフィット', 'ドローコードが付いた伸縮性のウエスト', 'ナイロン100％（プレーンウィーブ）', '両サイドにポケット', '伸縮性のあるカフ', '商品番号：IT2501', '色：ブラック', '生産国：Vietnam']","['', 'ウエスト', '股下', '股上', 'ヒップ', '裾回り']","['XS', 'S', 'M', 'L', 'XL', '2XL', '3XL', '65cm', '68cm', '73cm', '75cm', '80cm', '87cm', '94cm', '73cm', '73cm', '73cm', '73cm', '73cm', '73cm', '73cm', '33cm', '33cm', '33cm', '33cm', '34cm', '34cm', '35cm', '96cm', '99cm', '104cm', '106cm', '111cm', '117cm', '124cm', '23cm', '23cm', '25cm', '25cm', '27cm', '29cm', '29cm']","['4 / 5', '4 / 5']","['', '冬生地として使える', '']","['', '2024年2月15日', '']",['ブラックをスポーツ用として購入。ナイロン100%にて冬用として使えると思います。綿ポリのトラックパンツが寒いと感じた場合は色が被っても買っておいてよいのではと思います。綿ポリより伸縮性は劣るのでサイズは注意です。'],"['', 'messiah', 'messiah', '']"
アディカラー クラシックス ベッケンバウアー トラックパンツ（ジャージ）,"13,200",II5764,オリジナルス,"['https://shop.adidas.jp/photo/II/II5764/z-II5764-on_model-standard_view-whbyXM3ORt.jpg', 'https://shop.adidas.jp/photo/II/II5764/z-II5764-71-HtOg5SjB3S.jpg', 'https://shop.adidas.jp/photo/II/II5764/z-II5764-72-O2iofNeklz.jpg', 'https://shop.adidas.jp/photo/II/II5764/z-II5764-on_model-back_view-dattik7HzW.jpg', 'https://shop.adidas.jp/photo/II/II5764/z-II5764-on_model-walking_view-Wu0AX8sNVO.jpg', 'https://shop.adidas.jp/photo/II/II5764/z-II5764-3d_torso-front_center_view-xoMeo7z9jG.jpg', 'https://shop.adidas.jp/static/images/tools/itemCard_dummy.jpg', 'https://shop.adidas.jp/static/images/tools/itemCard_dummy.jpg']",https://shop.adidas.jp/products/II5764/,"['XS', 'S', 'M', 'L', 'XL', '2XL', '3XL']",,"['メンズ', 'ウェア・服', 'ボトムス', 'ジャージ', 'オリジナルス', 'ベッケンバウアー', 'アディカラー クラシック', 'アディカラー クラシックス ベッケンバウアー トラックパンツ（ジャージ）']",リサイクル&再生可能素材をブレンドした、アーカイブスタイルのトラックパンツ。,"タイムレスなクラシックアイテムでスタイルを格上げ。アディダスのアーカイブモデルを復刻したこのアディカラー ベッケンバウアー トラックパンツは、伝説的なサッカー選手へのオマージュを込めたデザイン。身体を包み込むスリムフィットの作りで、刺しゅうのトレフォイルとスリーストライプスでアイコニックな懐かしいルックスを継承している。ソフトなコットン混紡素材を使用しているから、何度でもはきたくなること間違いなし。

リサイクル素材と再生可能素材をブレンドした生地を70%以上使用したウェア。","['スリムフィット', 'ドローコードが付いた伸縮性のウエスト', '綿52% / ポリエステル48%（ピケ）', 'ジップ式フロントポケット', '背面にウェルトポケット', '商品番号：II5764', '色：ブラック/ホワイト', '生産国：Pakistan,Vietnam']",,,"['4 / 5', '4 / 5']","['', '店頭で試着', '']","['', '2024年3月4日', '']",['ネットでは2XLが最適と表示されていましたが、店頭で試着させて頂いたところボトムがL、上着がXLでちょうど良い感じでした。欲しい色が店頭に無かったためネットで購入。生地の素材は非常にやわらかくて気持ちいいです。★ひとつマイナスは、店舗によって在庫の有無がバラバラで購入に手間がかかったことが理由です。'],"['', 'zerozerozero', 'zerozerozero', '']"
アディカラー クラシックス カットラインパンツ,"6,270",HK7429,オリジナルス,"['https://shop.adidas.jp/photo/HK/HK7429/z-HK7429-on_model-standard_view-zgH0fqPCyg.jpg', 'https://shop.adidas.jp/photo/HK/HK7429/z-HK7429-on_model-back_view-KFSMJGv7Ng.jpg', 'https://shop.adidas.jp/photo/HK/HK7429/z-HK7429-on_model-walking_view-LnT3iQ508G.jpg', 'https://shop.adidas.jp/photo/HK/HK7429/z-HK7429-3d_torso-front_center_view-KTB0CeYQ3j.jpg', 'https://shop.adidas.jp/photo/HK/HK7429/z-HK7429-on_model-detail_view_1-RfkzaKd6Eb.jpg', 'https://shop.adidas.jp/photo/HK/HK7429/z-HK7429-on_model-detail_view_2-YjEVEu4Avz.jpg']",https://shop.adidas.jp/products/HK7429/,"['XS', 'S', 'M', 'L', 'XL', '2XL', '3XL']",,"['メンズ', 'ウェア・服', 'ボトムス', 'パンツ', 'オリジナルス', 'アディカラー', 'アディカラー クラシック', 'アディカラー クラシックス カットラインパンツ']",パーレイ・オーシャン・プラスチックを一部使用した、カジュアルなトラックパンツ。,"クラシックなルックスはそのままに、新たな遊びを採り入れた。多くのアスリートに愛された、スリムなシルエット、スリーストライプス、シューズを履いたまま着脱するのに便利なアンクルジップ。そうした欠かせない要素は変えずに、デザインで一歩前に踏み出したのがこのアディダスパンツ。オリジナルスタイルと同様に、気分良くプレーしたり、外出したりして過ごせるデザイン。ソフトなファブリックを身に纏って、その優しい風合いを存分に感じよう。

このウェアは、海洋汚染を防ぐために、離島や海岸、海沿いのコミュニティで海に流入する前に回収したプラスチック廃棄物をアップサイクルして生まれたパーレイ・オーシャン・プラスチックを50％含む糸で作られている。全体でリサイクル素材を40%以上使っている。","['スリムフィット', 'ドローコードが付いた伸縮性のウエスト', '綿52% / リサイクルポリエステル48%（ダブルニット）', '両サイドにジップポケット', '後ろにアンクルジップ', 'パーレイ・オーシャン・プラスチックを50%含む糸を使用', '全体でリサイクル素材を40%以上使用したウェア', '商品番号：HK7429', '色：ブラック', '生産国：China,Vietnam']",,"['XS', 'S', 'M', 'L', 'XL', '2XL', '3XL', '64cm', '67cm', '72cm', '74cm', '79cm', '86cm', '93cm', '72cm', '72cm', '72cm', '72cm', '72cm', '72cm', '72cm', '29cm', '29cm', '29cm', '30cm', '30cm', '31cm', '31cm', '90cm', '93cm', '98cm', '100cm', '105cm', '111cm', '118cm', '22cm', '22cm', '24cm', '24cm', '26cm', '28cm', '28cm']",,"['', 'デザインがお気に入り', '']","['', '2022年12月11日', '']",['メンズ商品だったのでサイズ感が心配でしたがピッタリでした。いつもメンズだとSサイズですが、この商品はMでよかったです。'],"['', 'Yuka', 'Yuka', '']"
フレーム デニムショーツ,"10,560",IS2893,オリジナルス,"['https://shop.adidas.jp/photo/IS/IS2893/z-IS2893-on_model-standard_view-gtdNvRHGL5.jpg', 'https://shop.adidas.jp/photo/IS/IS2893/z-IS2893-on_model-back_view-zrqgtYHLzR.jpg', 'https://shop.adidas.jp/photo/IS/IS2893/z-IS2893-on_model-walking_view-asfKFGhvTo.jpg', 'https://shop.adidas.jp/photo/IS/IS2893/z-IS2893-3d_torso-front_center_view-21Kz0VIOYV.jpg', 'https://shop.adidas.jp/photo/IS/IS2893/z-IS2893-on_model-detail_view_1-fafFvEiLzr.jpg', 'https://shop.adidas.jp/photo/IS/IS2893/z-IS2893-on_model-detail_view_2-umKiaMWvFW.jpg']",https://shop.adidas.jp/products/IS2893/,"['28', '30', '32', '33', '34', '35']",,"['メンズ', 'ウェア・服', 'ボトムス', 'ショートパンツ・短パン', 'オリジナルス', 'フレーム デニムショーツ']",炎のデザインが目を引く、コットンデニムショーツ。,このアディダスショーツで、おしゃれ魂に火をつけよう。素材にコットンデニムを使用した、ルーズフィットの快適な着心地の一着。抽象的な炎をスリーストライプスに重なるようにあしらって、モダンなルックスに仕上げている。街角でアクションを起こすときも、山を登るときも、このショーツをはいて心に火を灯そう。Tシャツや、タンクトップ、あるいはスニーカーと合わせて、クールなカジュアルスタイルに挑戦しよう。,"['ルーズフィット', 'ジップフライ / ボタンクロージャー', '綿100%（デニム）', '両サイドにポケット', '背面にポケット', '商品番号：IS2893', '色：ライトデニム']",,,,,,,
VRCT スウェットパンツ,"15,400",IS2900,オリジナルス,"['https://shop.adidas.jp/photo/IS/IS2900/z-IS2900-on_model-standard_view-hjCfquvYl5.jpg', 'https://shop.adidas.jp/photo/IS/IS2900/z-IS2900-on_model-back_view-w5OK4SEffG.jpg', 'https://shop.adidas.jp/photo/IS/IS2900/z-IS2900-on_model-walking_view-u0j5t3zcxh.jpg', 'https://shop.adidas.jp/photo/IS/IS2900/z-IS2900-3d_torso-front_center_view-MTyuvE7NDN.jpg', 'https://shop.adidas.jp/photo/IS/IS2900/z-IS2900-on_model-detail_view_1-FrUgkKXDfd.jpg', 'https://shop.adidas.jp/photo/IS/IS2900/z-IS2900-on_model-detail_view_2-4W9cmZ0juv.jpg']",https://shop.adidas.jp/products/IS2900/,"['XS', 'S', 'M', 'L', 'XL', '2XL', '3XL']",,"['メンズ', 'ウェア・服', 'ボトムス', 'スウェット（トレーナー）', 'オリジナルス', 'VRCT', 'VRCT スウェットパンツ']",アディダスの誇りをデザインに落とし込んだ、デイリースウェットパンツ。,心地よい風合いのソフトなコットン混紡フリース製のスウェットパンツをはいて、スポーティーな一面を見せつけよう。一方の脚にトレフォイルを、反対側の脚にadidasのグラフィックをあしらい、アディダスのプライドをこだまさせている。リブ仕上げのカフがシルエットを引き締める。,"['レギュラーフィット', 'ドローコードが付いた伸縮性のウエスト', '綿70% / ポリエステル30%（フリース［裏起毛］）', '両サイドにポケット', '伸縮性のあるカフ', '商品番号：IS2900', '色：ライトグレーヘザー']",,"['XS', 'S', 'M', 'L', 'XL', '2XL', '3XL', '64cm', '67cm', '72cm', '74cm', '79cm', '86cm', '93cm', '71cm', '71cm', '71cm', '71cm', '72cm', '72cm', '72cm', '30cm', '30cm', '31cm', '31cm', '31cm', '32cm', '33cm', '95cm', '98cm', '103cm', '105cm', '110cm', '116cm', '123cm', '24cm', '24cm', '26cm', '26cm', '28cm', '30cm', '30cm']",,,,,
ティロ 23 コンペティション ダウンタイムショーツ,"3,465",HK8041,サッカー,"['https://shop.adidas.jp/photo/HK/HK8041/z-HK8041-on_model-standard_view-if8M2U5TR7.jpg', 'https://shop.adidas.jp/photo/HK/HK8041/z-HK8041-on_model-back_view-lhsV6B8sY7.jpg', 'https://shop.adidas.jp/photo/HK/HK8041/z-HK8041-on_model-walking_view-efPw8o7ndX.jpg', 'https://shop.adidas.jp/photo/HK/HK8041/z-HK8041-on_model-standard_outfit_view-NEcVaVgBDQ.jpg', 'https://shop.adidas.jp/photo/HK/HK8041/z-HK8041-3d_torso-front_center_view-SKPMs88PPs.jpg', 'https://shop.adidas.jp/photo/HK/HK8041/z-HK8041-on_model-detail_view_1-IXgnPGvrXO.jpg', 'https://shop.adidas.jp/static/images/tools/itemCard_dummy.jpg']",https://shop.adidas.jp/products/HK8041/,"['2XS', 'XS', 'S', 'M', 'L', 'XL', '2XL', '3XL']",,"['メンズ', 'サッカー', 'ウェア・服', 'ボトムス', 'ショートパンツ・短パン', 'ティロ', 'ティロ 23 コンペティション ダウンタイムショーツ']",リサイクル素材を使用した、オフの日に快適さをもたらすショーツ。,"ピッチから離れても、ピッチにいる時と同じスタイルと感覚をキープしたい。このソフトで滑らかな肌触りのアディダス ショーツは、トレーニングの後のリラックスした時間や移動中に、身体を快適に包んでくれる。オフタイムに使用するスマートフォンや鍵、財布などを携帯できる、便利なジップポケットを備える。

リサイクル素材を100%使用したこの製品は、プラスチック廃棄物ゼロを目指すアディダスの取り組みの一つがカタチになったもの。","['レギュラーフィット', 'ドローコード付きのミッドライズの伸縮性ウエスト', 'リサイクルナイロン100%（平織り）', '前にジップポケット', '商品番号：HK8041', '色：チームネイビーブルー', '生産国：Philippines']",,,,,,,
スケートボーディング SST トラックパンツ（ジェンダーニュートラル）,"12,100",IU0118,オリジナルス,"['https://shop.adidas.jp/photo/IU/IU0118/z-IU0118-on_model-standard_unisex_pair_shot-OyGcLLHg7j.jpg', 'https://shop.adidas.jp/photo/IU/IU0118/z-IU0118-on_model-standard_unisex_back_view-JLdqXU8Mf1.jpg', 'https://shop.adidas.jp/photo/IU/IU0118/z-IU0118-on_model-standard_view-ZTlgdlZCD7.jpg', 'https://shop.adidas.jp/photo/IU/IU0118/z-IU0118-on_model-back_view-vunqlmn2hC.jpg', 'https://shop.adidas.jp/photo/IU/IU0118/z-IU0118-on_model-walking_view-RecwGXor4b.jpg', 'https://shop.adidas.jp/photo/IU/IU0118/z-IU0118-on_model-standard_outfit_view-ZexREp5kTA.jpg', 'https://shop.adidas.jp/static/images/tools/itemCard_dummy.jpg', 'https://shop.adidas.jp/static/images/tools/itemCard_dummy.jpg', 'https://shop.adidas.jp/static/images/tools/itemCard_dummy.jpg', 'https://shop.adidas.jp/static/images/tools/itemCard_dummy.jpg']",https://shop.adidas.jp/products/IU0118/,"['XS', 'S', 'M', 'L', 'XL', '2XL', '3XL']",,"['ユニセックス', 'スケートボーディング', 'ウェア・服', 'ボトムス', 'ジャージ', 'オリジナルス', 'スケートボーディング SST トラックパンツ（ジェンダーニュートラル）']",リサイクル&再生可能素材を一部使用した、名作にインスパイアされたスタイル。,"スリーストライプスのトラックウェアのアーカイブにインスパイアされたスケートボーディング向け定番アイテム。モダンなディテールとスケートボーディング向けのシルエットが特徴のトラックパンツ。これは、スタイリングと機能性の両立にフォーカスし、両サイドと背面に一つポケットを装備。伸縮性ウエストと裾のドローコードでフィット感を調節できる。様々なサイズ、ジェンダー、体型を考慮して、すべてのジェンダーに合うように構築したシステム、UNITEFITを採用してデザインされている。

リサイクル素材を選択することで、既に製造された製品の素材を再利用することができ、それがゴミの削減につながる。また、再生可能素材を選択することでも、限りある資源への依存を減らすことができる。このアディダス製品は、リサイクル素材や再生可能素材をブレンドしたものを70%以上使用している。","['レギュラーフィット', 'ドローコードが付いた伸縮性のウエスト', '綿57% / ポリエステル40% / ポリウレタン3%（リップストップ）', 'ミディアムライズのウエスト', 'フロントにウェルトポケット', 'バックにウェルトポケット', '調節可能な裾', 'リサイクル・再生可能素材を70%以上使用', '商品番号：IU0118', '色：カーボン/アイボリー']",,"['XS', 'S', 'M', 'L', 'XL', '2XL', '3XL', '68cm', '70cm', '73cm', '74cm', '77cm', '84cm', '91cm', '69cm', '70cm', '70cm', '70cm', '70cm', '70cm', '70cm', '31cm', '32cm', '33cm', '33cm', '34cm', '35cm', '35cm', '103cm', '104cm', '108cm', '110cm', '115cm', '121cm', '128cm', '42cm', '42cm', '43cm', '44cm', '45cm', '46cm', '47cm']","['3.5 / 5', '2 / 5', '5 / 5']","['', 'お勧めサイズではない', '', '', '質感、墨色が最高', '']","['', '2024年2月7日', '', '', '2024年2月14日', '']","['ウエストも足首にも調節用のドローストリングが入っていますが、大きすぎました。サイズ交換できたらいいのですが。', '光沢がないマットな質感とADILENIUMほどではないルーズなシルエットがめちゃくちゃ良いです。コスパも非常によいと思います。上下で2セット購入して着回しています。', '175cm、65kgでサイズL(セットアップのスケートボーディング ファイヤーバード トラックジャケットは2XL)']","['', 'numa', 'numa', '', '', 'oakc', 'oakc', '']"
アディカラー ウーブン ファイヤーバードトラックパンツ（ジャージ）,"15,400",IT2500,オリジナルス,"['https://shop.adidas.jp/photo/IT/IT2500/z-IT2500-on_model-standard_view-Rn61x2EPE0.jpg', 'https://shop.adidas.jp/photo/IT/IT2500/z-IT2500-on_model-back_view-dSenxgHbTr.jpg', 'https://shop.adidas.jp/photo/IT/IT2500/z-IT2500-on_model-walking_view-FhuNemFp5u.jpg', 'https://shop.adidas.jp/photo/IT/IT2500/z-IT2500-3d_torso-front_center_view-779EdOki0A.jpg', 'https://shop.adidas.jp/photo/IT/IT2500/z-IT2500-on_model-detail_view_1-uhEeAijq4I.jpg', 'https://shop.adidas.jp/photo/IT/IT2500/z-IT2500-on_model-detail_view_2-YxIK4xJxOT.jpg']",https://shop.adidas.jp/products/IT2500/,"['XS', 'S', 'M', 'L', 'XL', '2XL', '3XL']",,"['メンズ', 'ウェア・服', 'ボトムス', 'ジャージ', 'オリジナルス', 'ファイヤーバード', 'アディカラー ウーブン ファイヤーバードトラックパンツ（ジャージ）']",裾に伸縮性を持たせた、フレッシュなシルエットのトラックパンツ。,クラシックなストリートスタイルに今風のディテールを添えた、アディダス トラックパンツ。出かけるときにも、家でくつろぐときにも活躍。ウーブンファブリックが、アイコニックなデザインにテーラード風のひねりを加えている。Tシャツやスニーカーと合わせればくつろぎ感のあるスタイルに、またはタイムレスなボンバージャケットと組み合わせればコーディネートを格上げできる。,"['レギュラーフィット', 'ドローコードが付いた伸縮性のウエスト', 'ナイロン100％（プレーンウィーブ）', '両サイドにポケット', '伸縮性のあるカフ', '商品番号：IT2500', '色：ナイトインディゴ']",,,,,,,
SST ボンデッドトラックパンツ（ジャージ）,"12,100",IM9880,オリジナルス,"['https://shop.adidas.jp/photo/IM/IM9880/z-IM9880-on_model-standard_view-8YbCS5VmIv.jpg', 'https://shop.adidas.jp/photo/IM/IM9880/z-IM9880-on_model-back_view-nHcMbMKF5r.jpg', 'https://shop.adidas.jp/photo/IM/IM9880/z-IM9880-on_model-walking_view-3knucmizV9.jpg', 'https://shop.adidas.jp/photo/IM/IM9880/z-IM9880-3d_torso-front_center_view-CTIls1bLH1.jpg', 'https://shop.adidas.jp/photo/IM/IM9880/z-IM9880-on_model-detail_view_1-wbz4nARsR1.jpg', 'https://shop.adidas.jp/photo/IM/IM9880/z-IM9880-on_model-detail_view_2-qtGZb2vk7w.jpg']",https://shop.adidas.jp/products/IM9880/,"['XS', 'S', 'M', 'L', 'XL', '2XL', '3XL']",,"['メンズ', 'ウェア・服', 'ボトムス', 'ジャージ', 'オリジナルス', 'SST ボンデッドトラックパンツ（ジャージ）']",アディダスのDNAを受け継ぐ、ミニマルなデザインのトラックパンツ。,快適さとスタイルをバランスよく兼ね備えた、ワードローブの一番上の引き出しに迎え入れたくなるトラックパンツが登場。ソフトなプレーンウィーブ生地を使用し、リブ仕上げのカフとクラシックなカッティングを採用した、タイト過ぎず緩すぎない着心地の良い一枚。スポーティーな雰囲気の汎用性に優れたデザインだから、どんなカジュアルなシーンにもマッチする。,"['レギュラーフィット', 'ドローコードが付いた伸縮性のウエスト', 'ポリエステル100%（プレーンウィーブ）', '両サイドにポケット', 'リブ仕上げのカフ', '商品番号：IM9880', '色：ブラック', '生産国：Cambodia']",,"['XS', 'S', 'M', 'L', 'XL', '2XL', '3XL', '64cm', '67cm', '72cm', '74cm', '79cm', '86cm', '93cm', '71cm', '71cm', '71cm', '71cm', '72cm', '72cm', '72cm', '30cm', '30cm', '31cm', '31cm', '31cm', '32cm', '33cm', '95cm', '98cm', '103cm', '105cm', '110cm', '116cm', '123cm', '22cm', '22cm', '24cm', '24cm', '26cm', '28cm', '28cm']","['3 / 5', '3 / 5', '3 / 5']","['', '', '', '', '冬生地', '']","['', '2024年2月14日', '', '', '2024年2月15日', '']","['レビューに注文の多い商店ですね。さて、オレンジのラインも商品化してほしかった。アディダスジャージといえば、黒とオレンジ三本線です。', '黒黒をスポーツ用として購入。シャドウストライプがオシャレです。ポリエステル100%にて冬用として使えると思います。綿ポリのトラックパンツが寒いと感じたらこちらに切り替えるといいと思います。素材のせいか慣れている綿ポリと比べるとウエスト等が同じでもふくらはぎ周りがタイトに感じました。']","['', 'mrTORU1960', 'mrTORU1960', '', '', 'messiah', 'messiah', '']"
テニス AEROREADY プロ 2-IN-1 プロ ショーツ,"3,960",IU3204,テニス,"['https://shop.adidas.jp/photo/IU/IU3204/z-IU3204-on_model-standard_view-xJad9keDSY.jpg', 'https://shop.adidas.jp/photo/IU/IU3204/z-IU3204-on_model-back_view-SKonJ9LcpP.jpg', 'https://shop.adidas.jp/photo/IU/IU3204/z-IU3204-on_model-walking_view-f0d5eAcAEO.jpg', 'https://shop.adidas.jp/photo/IU/IU3204/z-IU3204-on_model-standard_outfit_view-p8rkbwAbFT.jpg', 'https://shop.adidas.jp/photo/IU/IU3204/z-IU3204-3d_torso-front_center_view-eYugYjrDTq.jpg', 'https://shop.adidas.jp/photo/IU/IU3204/z-IU3204-3d_torso-standard_top_part_view-pmVfarsT5i.jpg', 'https://shop.adidas.jp/static/images/tools/itemCard_dummy.jpg', 'https://shop.adidas.jp/static/images/tools/itemCard_dummy.jpg', 'https://shop.adidas.jp/static/images/tools/itemCard_dummy.jpg']",https://shop.adidas.jp/products/IU3204/,"['S', 'M', 'L', 'XL', '2XL', '3XL']",,"['メンズ', 'テニス', 'ウェア・服', 'ボトムス', 'ショートパンツ・短パン', 'テニス AEROREADY プロ 2-in-1 プロ ショーツ']",リサイクル素材を一部使用した、変化に挑戦できるテニスショーツ。,"女子テニス協会の設立および、男女差別が残っていた時代のテニス界の象徴的事件、""Battle of the Sexes（性別間の争い）""から50年が経った今、現状を打破することの素晴らしさを讃えるものとして生まれたのが、このアディダスのテニスショーツ。アウターショーツは、高光沢のサテンファブリック。さりげなく目を引くプリントをあしらった、セパレートタイプのインナーショーツが付いている。通気を促すメッシュガセットと吸湿性に優れたAEROREADYにより、白熱するプレー中も身体を爽やかに保つ。

プラスチックゴミ ゼロを目指すアディダスの取り組みの一つをカタチにした、リサイクル素材を70%以上使用したアイテム。","['レギュラーフィットショーツ / タイトフィットのインナーショーツ', 'アウターショーツ：ドローコード付きの伸縮性ウエスト', 'アウターショーツ：ポリエステル100%（ツイル）', 'インナーショーツ：ポリエステル79% / ポリウレタン21%（インターロック）', 'AEROREADY', 'アウターショーツ：フロントポケット', 'アウターショーツ：メッシュガセット', '商品番号：IU3204', '色：グレーワン/グレーワン', '生産国：Cambodia,Vietnam']",,,,,,,
