coordinated_product_name,pricing,product_number,category,image_urls,product_page_url,available_sizes,sense_of_the_sizes,breadcrumbs,product_title,product_generation_description,product_itemization_generation_descriptions,table_first_column_contents,table_all_row_contents,review_stars,review_titles,review_dates,review_descriptions,review_nicknames
スタンスミス / STAN SMITH,"15,400",FX5508,オリジナルス,"['https://shop.adidas.jp/photo/FX/FX5508/z-FX5508-standard-side_lateral_center_view.jpg', 'https://shop.adidas.jp/photo/FX/FX5508/z-FX5508-standard-top_portrait_view.jpg', 'https://shop.adidas.jp/photo/FX/FX5508/z-FX5508-standard-bottom_view.jpg', 'https://shop.adidas.jp/photo/FX/FX5508/z-FX5508-standard-front_lateral_top_view.jpg', 'https://shop.adidas.jp/photo/FX/FX5508/z-FX5508-standard-back_lateral_top_view.jpg', 'https://shop.adidas.jp/photo/FX/FX5508/z-FX5508-standard-side_medial_center_view.jpg', 'https://shop.adidas.jp/static/images/tools/itemCard_dummy.jpg', 'https://shop.adidas.jp/static/images/tools/itemCard_dummy.jpg', 'https://shop.adidas.jp/static/images/tools/itemCard_dummy.jpg']",https://shop.adidas.jp/products/FX5508/,"['22.0cm', '22.5cm', '23.0cm', '23.5cm', '24.0cm', '24.5cm', '25.0cm', '25.5cm', '26.0cm', '26.5cm', '27.0cm', '27.5cm', '28.0cm', '28.5cm', '29.0cm', '29.5cm', '30.0cm', '30.5cm', '31.0cm']","['小さめ', '適切', '大きめ']","['ユニセックス', 'シューズ・靴', 'スニーカー', 'オリジナルス', 'スタンスミス', 'スタンスミス / Stan Smith']",定番スタンスミスのレースレス モデル。,"履きやすくて脱ぎやすい、そして地球に優しい。このスタンスミスシューズは、プラスチック廃棄物ゼロを目指すアディダスの取り組みに沿って、リサイクル素材を原料に使用したモデル。合成皮革アッパーと、廃棄ゴムからできたアウトソールで、アイコニックなスタイルがエシカルに生まれ変わった。シューレースの代わりに脱ぎ履きのラクな面ファスナーストラップを搭載。急いで出かけるとき、そして一日の終わりに疲れた足を靴から早く解放させたいときに便利。

高性能リサイクル素材シリーズの一つ、PRIMEGREENを採用したアイテム。アッパーの50%はリサイクル素材でできていて、バージンポリエステルは不使用。","['レギュラーフィット', '面ファスナーストラップ', '合成皮革アッパー', '合成ライニング', 'ラバーアウトソール', 'PRIMEGREEN', '商品番号：FX5508', '色：フットウェアホワイト/フットウェアホワイト/ゴールドメタリック', '生産国：India,Vietnam']",,,"['4.3 / 5', '2 / 5', '5 / 5', '5 / 5', '1 / 5', '3 / 5', '5 / 5', '5 / 5', '5 / 5', '4 / 5', '4 / 5']","['', '改悪です', '', '', 'ヒモなしシューズも必要なアイテムでは？', '', '', '装具使用者には最適な一足', '', '', '同じベルクロのマスターを天然皮革で出してください。', '', '', '幅広甲高には‥', '', '', '', '', '', '２足目です。', '', '', '', '', '', 'デザインが気に入ってます', '', '', 'ずっとベルクロです。', '']","['', '2023年1月13日', '', '', '2022年4月29日', '', '', '2022年10月28日', '', '', '2021年9月17日', '', '', '2021年5月31日', '', '', '2023年4月8日', '', '', '2022年8月4日', '', '', '2022年9月25日', '', '', '2022年10月15日', '', '', '2023年8月21日', '']","['ベルクロのスタンスミスを履き続けて5足目です\nリサイクル素材になり履いた時の柔軟性が悪くなりました\n素材を変えるのであれば前モデルよりを上回る物を作って欲しいです\n改善品ならぬ改悪品になってしまって悲しいです', '他メーカーのヒモなしシューズの買い替えで購入。シューズサイズは、足のジャストサイズより0.5cm大きいのを試着したが、ジャストサイズでもやや余裕があります。参考まで…', '左半身麻痺の私が日常的に短下肢装具をつけた足で履ける数少ないスニーカーがこれです。カラバリが増えるともっと最高！', 'ベルクロのスタンスミスも合皮になってしまい非常に残念。仕様もサイドの金色のスタンスミスロゴ無し、ソールもクリームがかったタイプではなく、ベロの裏もチープで量販店の廉価版と同じ作り。それでこの価格は疑問。どうせなら同じベルクロのマスターを天然皮革で出してもらいたいです。', '幅広甲高の私の足にはマジックテープの部分が端までしっかり被らず、そのために丈の長いスカートの裾がマジックに引っ掛かり、ちょっと残念です。', '白と緑のコントラストがちょうどマッチしており\n足首にフィットし柔らかく履きやすい\n靴底の強度がゆ弱いようで、歩き方が悪いのか半年弱でスレて穴が開いてしまった。', 'シューレスよりも履きやすくストラップの締め具合で足にフィットするのがとても手軽に感じており自分にとってはとても歩きやすいです。', 'スタンスミスを初めて購入しました、大変軽く履き心地も良かったです。マジックテープですし脱ぎ掃きもとても楽ちんでした。', '長年愛用させていただいています。\nデザインと着脱の楽さが気に入ってます。\n白なので、汚れがつかないコーティングなどのサービスがあると嬉しいです。\n同じデザインのゴルフシューズがあれば購入します。', '子供を生んだら、脱ぎ履きしやすいベルクロがさらに気に入り、ずっとはいています。最近は履いている人をよく見るので、履くのやめてますが、シルバーとか気になっています。']","['', 'Dankichi', 'Dankichi', '', '', 'hungten', 'hungten', '', '', 'TaDa3', 'TaDa3', '', '', 'kgdk', 'kgdk', '', '', 'mogurin', 'mogurin', '', '', 'taka', 'taka', '', '', 'tagoyan230', 'tagoyan230', '', '', 'Ochanochan', 'Ochanochan', '', '', 'muck', 'muck', '', '', 'umiumi', 'umiumi', '']"
ガゼルボールド / GAZELLE BOLD,"16,500",HQ6912,オリジナルス,"['https://shop.adidas.jp/photo/HQ/HQ6912/z-HQ6912-standard-side_lateral_center_view-uBfXPyq1hV.jpg', 'https://shop.adidas.jp/photo/HQ/HQ6912/z-HQ6912-71-X5iDy0HK06.jpg', 'https://shop.adidas.jp/photo/HQ/HQ6912/z-HQ6912-72-tJhlhbAyIZ.jpg', 'https://shop.adidas.jp/photo/HQ/HQ6912/z-HQ6912-73-cZx5dIEBd7.jpg', 'https://shop.adidas.jp/photo/HQ/HQ6912/z-HQ6912-74-eKzAzgYpY5.jpg', 'https://shop.adidas.jp/static/images/tools/itemCard_dummy.jpg', 'https://shop.adidas.jp/static/images/tools/itemCard_dummy.jpg', 'https://shop.adidas.jp/static/images/tools/itemCard_dummy.jpg', 'https://shop.adidas.jp/static/images/tools/itemCard_dummy.jpg', 'https://shop.adidas.jp/static/images/tools/itemCard_dummy.jpg', 'https://shop.adidas.jp/static/images/tools/itemCard_dummy.jpg', 'https://shop.adidas.jp/static/images/tools/itemCard_dummy.jpg', 'https://shop.adidas.jp/static/images/tools/itemCard_dummy.jpg', 'https://shop.adidas.jp/static/images/tools/itemCard_dummy.jpg', 'https://shop.adidas.jp/static/images/tools/itemCard_dummy.jpg', 'https://shop.adidas.jp/static/images/tools/itemCard_dummy.jpg', 'https://shop.adidas.jp/static/images/tools/itemCard_dummy.jpg', 'https://shop.adidas.jp/static/images/tools/itemCard_dummy.jpg']",https://shop.adidas.jp/products/HQ6912/,"['22.0cm', '22.5cm', '23.0cm', '23.5cm', '24.0cm', '24.5cm', '25.0cm', '25.5cm', '26.0cm', '26.5cm', '27.0cm', '27.5cm', '28.0cm']","['小さめ', '適切', '大きめ']","['ユニセックス', 'シューズ・靴', 'スニーカー', 'オリジナルス', 'ガゼル', 'ガゼルボールド / Gazelle Bold']",大胆な進化を遂げた、クラシック ガゼル。,"ガゼルがなかったら、「アディダスの最もアイコニックなシューズのリスト」は完成しない。70年代、インドアコート向けに誕生し、今なお新たなファンを増やし続けるスエードシューズ。今季モデルでは、その愛されるスタイルがさらなる高みへ到達した。3層構造のアウトソールで高さを増し、クラシックスタイルに新たな解釈を加えた一足。滑らかでソフトなスエードとギザギザのスリーストライプスのスポーティーなディテールはそのまま。メタリックゴールドの""Gazelle""のレタリングは、アディダスのヘリテージの証し。","['レギュラーフィット', 'シューレースクロージャー', 'スエードアッパー', '合成素材のライニング', 'ラバーアウトソール', '商品番号：HQ6912', '色：コアブラック/フットウェアホワイト/コアホワイト', '生産国：Indonesia,Vietnam']",,,"['4.6 / 5', '5 / 5', '5 / 5', '5 / 5', '4 / 5', '3 / 5', '5 / 5', '5 / 5', '5 / 5', '5 / 5', '5 / 5']","['', '最高のスニーカー', '', '', '見た目よりもはきやすい', '', '', 'いい', '', '', 'シュータンが少し気になる', '', '', '見た目はGOOD', '', '', '素晴らしい厚底', '', '', 'めっちゃ可愛い！', '', '', '大きめ！', '', '', '流石アディダス製！', '', '', '', '']","['', '2023年8月7日', '', '', '2024年1月9日', '', '', '2023年1月15日', '', '', '2023年2月17日', '', '', '2023年6月15日', '', '', '2023年6月18日', '', '', '2023年8月2日', '', '', '2024年1月21日', '', '', '2024年2月4日', '', '', '2024年2月4日', '']","['緑が好きなカラーなのでとても気に入っています！ところどころピンクがカラーとして入っているのも気に入っています。ソールが厚いので歩きずらさを心配していましたが、全く問題なく安心しました。', 'デザインに惹かれたので、正直履き心地は期待していませんでしたが、程よいクッションがありとても履き心地が良いです！！長時間歩く時でも疲れませんでした。見た目も可愛いしオススメです！！', 'ブラック購入。とにかく可愛いい。横幅あるのできついとかは無いかと。いつものサイズを購入し快適。足の細い人は、サイズダウンが良いかも。', 'デザインに一目惚れして購入。素材の問題なのか、シュータンが内側に巻き込まれることがあり、長時間の使用はキツイ印象。\nサイズをハーフアップして方が良かったかも。', '普段22.5〜23.0を履きますがこれは22センチ。横は幅広ですが、ちょっと大きくて、かなり中も平らなので歩く度フカフカする印象。色々選ぶの面倒&色味は好きだったので買いましたが履き心地はイマイチでした。それと靴紐長い気がします。', 'タックパンツにあうadidasスニーカーを探してましたが、いい感じです！\n履き心地も最高ですし、スニーカーはadidasと決めてます？', '可愛くて気に入ってます！足元が明るくて気分が上がります。毎日履いても飽きません。良い買い物ができました。', 'かわいい！サイズは0.5下げたらちょうどよかった。文字数足らないって…何を書けばいいかわかりません。。。', 'ガゼルボールドのスニーカーを購入。色合いやデザインが気に入り迷わず即買い。到着後即履きました。履き心地やフィット感も感触も問題無しです。また表面の風合いも申し分ない。流石アディダス製です！', '可愛らしいピンクと明るい緑の配色でとっても可愛いです。厚底ですが軽く歩きやすいです。普段25センチなのですが、24.5センチでも履くことができたので一度店舗でサイズを確認した方がいいと思います。']","['', 'yogyee03', 'yogyee03', '', '', 'riera', 'riera', '', '', 'cris13', 'cris13', '', '', 'soraq', 'soraq', '', '', 'riny', 'riny', '', '', 'zooy', 'zooy', '', '', 'ao007', 'ao007', '', '', 'Yuki', 'Yuki', '', '', 'naipapa55', 'naipapa55', '', '', 'Kristen', 'Kristen', '']"
ADIDASFLCN,"9,570",IG8301,オリジナルス,"['https://shop.adidas.jp/photo/IG/IG8301/z-IG8301-standard-side_lateral_center_view-qEC0c9EXe7.jpg', 'https://shop.adidas.jp/photo/IG/IG8301/z-IG8301-71-RNf89cE5cT.jpg', 'https://shop.adidas.jp/photo/IG/IG8301/z-IG8301-72-wVSRCeldUc.jpg', 'https://shop.adidas.jp/photo/IG/IG8301/z-IG8301-73-Rp4COD737i.jpg', 'https://shop.adidas.jp/photo/IG/IG8301/z-IG8301-on_model-front_view-oiIYjxdsbx.jpg', 'https://shop.adidas.jp/static/images/tools/itemCard_dummy.jpg', 'https://shop.adidas.jp/static/images/tools/itemCard_dummy.jpg', 'https://shop.adidas.jp/static/images/tools/itemCard_dummy.jpg', 'https://shop.adidas.jp/static/images/tools/itemCard_dummy.jpg', 'https://shop.adidas.jp/static/images/tools/itemCard_dummy.jpg', 'https://shop.adidas.jp/static/images/tools/itemCard_dummy.jpg', 'https://shop.adidas.jp/static/images/tools/itemCard_dummy.jpg', 'https://shop.adidas.jp/static/images/tools/itemCard_dummy.jpg', 'https://shop.adidas.jp/static/images/tools/itemCard_dummy.jpg']",https://shop.adidas.jp/products/IG8301/,"['22.0cm', '22.5cm', '23.0cm', '23.5cm', '24.0cm', '24.5cm', '25.0cm', '25.5cm', '26.0cm', '26.5cm', '27.0cm', '27.5cm', '28.0cm', '28.5cm', '29.0cm']",,"['ユニセックス', 'シューズ・靴', 'スニーカー', 'オリジナルス', 'ADIDASFLCN', 'adidasFLCN']",毎日を快適にする、軽量メッシュのスポーティースタイル。,90年代のアーカイブエディションをヒントに、がっしりとした存在感のあるシルエットのバランスをモダンなスタイルに再構築したモデル。　柔軟なメッシュアッパーに、スタイリッシュな合成スエードのオーバーレイをあしらい、ラバーアウトソールを合わせて、グリップ力と安定感という機能性もプラスした。,"['レギュラーフィット', 'シューレースクロージャー', 'メッシュアッパーに上質な合成スエードのオーバーレイ', 'テキスタイルライニング', '合成繊維（EVA）のミッドソール', 'ラバーアウトソール', '商品番号：IG8301', '色：コアブラック/コアブラック/フットウェアホワイト', '生産国：Vietnam']",,,,,,,
スーパースター / SUPERSTAR,"10,890",EG4957,オリジナルス,"['https://shop.adidas.jp/photo/EG/EG4957/z-EG4957-standard-side_lateral_center_view.jpg', 'https://shop.adidas.jp/photo/EG/EG4957/z-EG4957-marketing-heromrktng_view_1.jpg', 'https://shop.adidas.jp/photo/EG/EG4957/z-EG4957-91-2ojaZhwnS1.jpg', 'https://shop.adidas.jp/photo/EG/EG4957/z-EG4957-standard-top_portrait_view.jpg', 'https://shop.adidas.jp/photo/EG/EG4957/z-EG4957-standard-bottom_view.jpg', 'https://shop.adidas.jp/photo/EG/EG4957/z-EG4957-standard-front_lateral_top_view.jpg', 'https://shop.adidas.jp/static/images/tools/itemCard_dummy.jpg', 'https://shop.adidas.jp/static/images/tools/itemCard_dummy.jpg', 'https://shop.adidas.jp/static/images/tools/itemCard_dummy.jpg', 'https://shop.adidas.jp/static/images/tools/itemCard_dummy.jpg', 'https://shop.adidas.jp/static/images/tools/itemCard_dummy.jpg', 'https://shop.adidas.jp/static/images/tools/itemCard_dummy.jpg', 'https://shop.adidas.jp/static/images/tools/itemCard_dummy.jpg']",https://shop.adidas.jp/products/EG4957/,"['22.0cm', '22.5cm', '23.0cm', '23.5cm', '24.0cm', '24.5cm', '25.0cm', '25.5cm', '26.0cm', '26.5cm', '27.0cm', '27.5cm', '28.0cm', '28.5cm', '29.0cm', '29.5cm', '30.0cm', '30.5cm', '31.0cm', '31.5cm', '32.0cm', '32.5cm', '33.5cm', '34.5cm']","['小さめ', '適切', '大きめ']","['ユニセックス', 'シューズ・靴', 'スニーカー', 'オリジナルス', 'スーパースター', 'スーパースター / Superstar']",アディダス・オリジナルスが誇る名作、スーパースター。,バスケットボールシューズとして誕生し、スケートボーディングとヒップホップシーンで人気を集めた、レザー製のクラシックスニーカー、スーパースターは、コートを飛び出すやいなや、ゲームチェンジャーとなった。ギザギザのスリーストライプス、アイコニックなシェルトゥ、ボックスロゴが特徴の、アディダス オリジナルス自慢の一足。　※「Super Star」は、株式会社ムーンスターの日本における登録商標です。,"['シューレースクロージャー', 'レザーアッパー', 'アイコニックなレザーシューズ', 'ラバーアウトソール', '商品番号：EG4957', '色：コアブラック/コアブラック/コアブラック', '生産国：Indonesia']",,,"['4.7 / 5', '5 / 5', '5 / 5', '5 / 5', '4 / 5', '5 / 5', '5 / 5', '5 / 5', '4 / 5', '4 / 5', '5 / 5']","['', 'サイズ感について', '', '', '伝統のスーパースター', '', '', '', '', '', 'サイズ感', '', '', '永久定番', '', '', 'スーパースター一択', '', '', 'スタンスミスと同じく気に入ってます', '', '', '小6の息子に', '', '', '久しぶりのスーパースター', '', '', '定番', '']","['', '2023年10月16日', '', '', '2023年12月31日', '', '', '2022年5月3日', '', '', '2023年9月22日', '', '', '2022年5月11日', '', '', '2022年6月9日', '', '', '2021年1月1日', '', '', '2024年1月8日', '', '', '2022年9月25日', '', '', '2021年6月8日', '']","['色々なレビューでタイトすぎるから「ワンサイズ大きめを買った方がいい」という言葉を見るが、丁度のサイズを履いてみたら全く気にならなかったので、ワンサイズ大きくする必要はないと感じた。', '履いていてやはり安心感があります。そしてどんなファッションにも合わせやすい。カラーバリーエーションも豊富で、たくさん欲しくなってしまいます。まずは定番の黒で！', '定番のスーパースターでありますが、天然皮革であり、使いこなせばこなすほどにフィット感が増してくることに、ある種の喜びを感じます。手入れを怠らず永津付きあっていきたいと思います。', 'サイズ感に関しては他の方も言っている通り少しタイトだったので次からは0.5upサイズで購入しようと思いました。\n履き心地は並ですが、デザインに関しては洗練されており素晴らしいです。', 'ファッションにおけるアディダスの地位を確立した、定番中の定番。どんなスタイルにも合いますので、少し気分が離れてもまた履きたくなる魅力があります。', '主人用に。私はスタンスミス派ですが彼は幅広、甲高の足なのでスーパースターがしっくりくるそう。\nボロボロになったら新しいのにするのでセール中に購入しときます。', '三本ラインがadidasを特徴付けていて、あとは色の配色違いだけでほとんど選べるので、気分ではきかえています。スタンスミスも長年愛用してましが、こちらもアイテムとしては必ずもってます。', '普段はアシックスのスニーカーやサッカーのトレシューでジュニアサイズの24.5cmを履いていますが、これは大人サイズで24cmを購入。それでも余裕があり成長も考慮すると良いサイズ感だと思います。', 'スタンスミスの28.0cm を履いているけどスーパースターがセールで在庫が28.5cmしかなかったので購入。やはり28.0cmにすればよかったかも。\n0.5cmを甘く見てしまった。 厚手の靴下で何とか対応しよう。', '初めて買った時から5年経ちましたが、未だに同じモデル、カラーで買い直して履いています。それくらいシンプルでかっこよくて、合わせやすいです。']","['', 'Gelmai', 'Gelmai', '', '', 'tm7tm77', 'tm7tm77', '', '', 'yasuyasu', 'yasuyasu', '', '', 'CSantenna', 'CSantenna', '', '', 'Dandan', 'Dandan', '', '', 'puu6', 'puu6', '', '', 'KI1220', 'KI1220', '', '', 'haru', 'haru', '', '', 'tttyyy23', 'tttyyy23', '', '', 'Zuma', 'Zuma', '']"
スーパースター GORE-TEX / SUPERSTAR GORE-TEX,"18,700",IF6162,オリジナルス,"['https://shop.adidas.jp/photo/IF/IF6162/z-IF6162-standard-side_lateral_center_view-1Gomh8BnTK.jpg', 'https://shop.adidas.jp/photo/IF/IF6162/z-IF6162-standard-top_portrait_view-el5dFMVaO1.jpg', 'https://shop.adidas.jp/photo/IF/IF6162/z-IF6162-standard-bottom_view-0iwBMX1MI4.jpg', 'https://shop.adidas.jp/photo/IF/IF6162/z-IF6162-standard-front_lateral_top_view-Thzof8Vd1L.jpg', 'https://shop.adidas.jp/photo/IF/IF6162/z-IF6162-standard-back_lateral_top_view-QjpPFmBnRL.jpg', 'https://shop.adidas.jp/photo/IF/IF6162/z-IF6162-standard-side_medial_center_view-NLoxiJR6mk.jpg', 'https://shop.adidas.jp/static/images/tools/itemCard_dummy.jpg', 'https://shop.adidas.jp/static/images/tools/itemCard_dummy.jpg', 'https://shop.adidas.jp/static/images/tools/itemCard_dummy.jpg']",https://shop.adidas.jp/products/IF6162/,"['22.0cm', '22.5cm', '23.0cm', '23.5cm', '24.0cm', '24.5cm', '25.0cm', '25.5cm', '26.0cm', '26.5cm', '27.0cm', '27.5cm', '28.0cm', '28.5cm', '29.0cm', '29.5cm', '30.0cm', '30.5cm', '31.0cm']",,"['ユニセックス', 'シューズ・靴', 'スニーカー', 'オリジナルス', 'スーパースター', 'スーパースター GORE-TEX / Superstar GORE-TEX']",防水アッパーを搭載した、全天候型アイコンスニーカー。,雨が降っても、雪が降っても、このアディダス スーパースターなら無敵。世界中に知られるクラシックなスタイルの魅力を損なうことなく、透湿性を確保しながら悪天候をブロックする、GORE-TEXメンブレンを採用したスニーカー。1970年にバスケットボールコートに登場したスーパースターは、数十年にわたりストリートカルチャーを見続けてきた。フレッシュなヌバックアッパーを搭載した、アイコニックなシェルトゥシューズが、また現代社会に一歩踏み出す。防水・防風性に富むシューズが、外でどんな状況になっても、快適な履き心地で力強い足運びをサポートしてくれる。　※「Super Star」は、株式会社ムーンスターの日本における登録商標です。,"['レギュラーフィット', 'シューレースクロージャー', 'ヌバックアッパー', 'GORE-TEX メンブレン', '合成ライニング', 'ラバーアウトソール', '商品番号：IF6162', '色：コアブラック/コアブラック/フットウェアホワイト']",,,"['4.5 / 5', '5 / 5', '4 / 5']","['', '雨の日に履くのが楽しみ', '', '', '', '']","['', '2023年12月18日', '', '', '2024年2月3日', '']","['', '', '', 'adidasスニーカーについては近頃ゴア製品に目をつけスタンスミス＆スペティアル等をき続けてますが今回SSのカラーが気に入り購入です。']","['', 'ひゃおちゃん', 'ひゃおちゃん', '', '', 'sakura2022', 'sakura2022', '']"
