coordinated_product_name,pricing,product_number,category,image_urls,product_page_url,available_sizes,sense_of_the_sizes,breadcrumbs,product_title,product_generation_description,product_itemization_generation_descriptions,table_first_column_contents,table_all_row_contents,review_stars,review_titles,review_dates,review_descriptions,review_nicknames
FEAR OF GOD ATHLETICS I バスケットボール / FEAR OF GOD ATHLETICS I BASKETBALL,"38,500",IE6180,スポーツウェア,"['https://shop.adidas.jp/photo/IE/IE6180/z-IE6180-marketing-heromrktng_view_1-8Ncs7widGz.jpg', 'https://shop.adidas.jp/photo/IE/IE6180/z-IE6180-marketing-heromrktng_view_2-7S2iV31zxg.jpg', 'https://shop.adidas.jp/photo/IE/IE6180/z-IE6180-marketing-heromrktng_view_4-cqhgZ5Ztsg.jpg', 'https://shop.adidas.jp/photo/IE/IE6180/z-IE6180-on_model-heromrktng_view_1-9Uuq0l6fu8.jpg', 'https://shop.adidas.jp/photo/IE/IE6180/z-IE6180-on_model-heromrktng_view_3-K9E9GQKhMc.jpg', 'https://shop.adidas.jp/photo/IE/IE6180/z-IE6180-on_model-heromrktng_view_4-yhXXDQRb6n.jpg', 'https://shop.adidas.jp/static/images/tools/itemCard_dummy.jpg']",https://shop.adidas.jp/products/IE6180/,,,"['ユニセックス', 'シューズ・靴', 'スニーカー', 'スポーツウェア', 'Fear of God Athletics', 'Fear of God Athletics I バスケットボール / Fear of God Athletics I Basketball']",FEAR OF GOD ATHLETICSからバスケットボールシューズが登場。,ファッションとスポーツのユニークな融合から生まれたバスケットボールシューズが登場。すっきりした薄底シューズの半透明のラバーアウトソールに刻まれた溝に、Fear of Godらしいスタイルが見てとれる。上質なニットアッパーにネオプレンの履き口、トグル付きのアンクルバンジーコード、縫い目のないTPUフィルムオーバーレイ、Lightstrikeミッドソールなど、快適な履き心地を提供するテクノロジーとディテールが詰まったシューズ。アディダスのプレデタースパイクのアーカイブからヒントを得たスリーストライプス成型ケージ、そしてそれぞれエンボス加工であしらったつま先のadidasロゴと、ヒールのブラックバーとFear of Godロゴなどのアイコニックなブランディングが、このコラボレーションの証。,"['レギュラーフィット', 'シューレースクロージャー', 'レギュラーフィット', 'シューレースクロージャー', 'ポリエステル92% / ポリウレタン8%（ダブルニット）', 'トグル付きアンクルバンジー', 'サイドシームポケットに、通気孔のある4ウェイストレッチ生地の裏地付き', 'Lightstrikeクッショニング', 'フロント中央にスエード調スリーピラーロゴ', 'つま先にadidasロゴをエンボス加工', '商品番号：IE6180', '色：クレイ/クレイ/クレイ']",,,,,,,
FEAR OF GOD ATHLETICS ロサンゼルス / FEAR OF GOD ATHLETICS LOS ANGELES,"26,400",IF4215,スポーツウェア,"['https://shop.adidas.jp/photo/IF/IF4215/z-IF4215-on_model-heromrktng_view_1-k6C4QOJtVV.jpg', 'https://shop.adidas.jp/photo/IF/IF4215/z-IF4215-on_model-heromrktng_view_3-wG4Di3rZHy.jpg', 'https://shop.adidas.jp/photo/IF/IF4215/z-IF4215-on_model-heromrktng_view_4-OdfVNsSFQ8.jpg', 'https://shop.adidas.jp/photo/IF/IF4215/z-IF4215-on_model-heromrktng_view_5-7uLK97e8jW.jpg', 'https://shop.adidas.jp/photo/IF/IF4215/z-IF4215-on_model-heromrktng_view_6-IUmHhoVXwc.jpg', 'https://shop.adidas.jp/photo/IF/IF4215/z-IF4215-06-BVVzG9QyRy.jpg', 'https://shop.adidas.jp/static/images/tools/itemCard_dummy.jpg', 'https://shop.adidas.jp/static/images/tools/itemCard_dummy.jpg', 'https://shop.adidas.jp/static/images/tools/itemCard_dummy.jpg', 'https://shop.adidas.jp/static/images/tools/itemCard_dummy.jpg']",https://shop.adidas.jp/products/IF4215/,,,"['ユニセックス', 'シューズ・靴', 'スニーカー', 'スポーツウェア', 'Fear of God Athletics', 'Fear of God Athletics ロサンゼルス / Fear of God Athletics Los Angeles']",FEAR OF GOD ATHLETICSが贈る、LAトレーナー。,アイコニックなLA トレーナーを、Fear of God Athleticsが再構築。高品質なスエードと丈夫なリップストップファブリック、ウェイビーなラバーアウトソールを組み合わせたシューズ。パッド入りシュータン、快適な履き心地をもたらすEVAミッドソール、フィット感を調節しやすいトグル付きシューレースなど、特徴的な要素も満載。クォーターパネルにはスリーストライプス、ソールにはadidasロゴをエンボス加工、さらにかかとのブラックバーにFear of Godロゴをエンボス加工するなど、随所にブランディングを施している。,"['レギュラーフィット', 'テキスタイルアッパー', 'ラバーアウトソール', '商品番号：IF4215', '色：クレイ/クレイ/クレイ']",,,,,,,
バリ / BALI,"16,500",IG6195,オリジナルス,"['https://shop.adidas.jp/photo/IG/IG6195/z-IG6195-standard-side_lateral_center_view-V8m9r2Ki0a.jpg', 'https://shop.adidas.jp/photo/IG/IG6195/z-IG6195-standard-top_portrait_view-Zax85hoWCE.jpg', 'https://shop.adidas.jp/photo/IG/IG6195/z-IG6195-standard-bottom_view-vnAVWR3AF8.jpg', 'https://shop.adidas.jp/photo/IG/IG6195/z-IG6195-standard-front_lateral_top_view-pSAvh2Ratw.jpg', 'https://shop.adidas.jp/photo/IG/IG6195/z-IG6195-standard-back_lateral_top_view-DFZyQyHjhb.jpg', 'https://shop.adidas.jp/photo/IG/IG6195/z-IG6195-standard-side_medial_center_view-4Kwkamun2g.jpg', 'https://shop.adidas.jp/static/images/tools/itemCard_dummy.jpg', 'https://shop.adidas.jp/static/images/tools/itemCard_dummy.jpg', 'https://shop.adidas.jp/static/images/tools/itemCard_dummy.jpg', 'https://shop.adidas.jp/static/images/tools/itemCard_dummy.jpg']",https://shop.adidas.jp/products/IG6195/,,,"['ユニセックス', 'シューズ・靴', 'スニーカー', 'オリジナルス', 'バリ / Bali']",南の島をイメージしてワントーンでまとめた、スエードスニーカー。,アイコニックなアイランドシリーズの一つ、バリは、1977年にデビューしたフランス製シューズを振り返るバージョン。上質なスエードアッパーのシューズに足を入れるだけで、快適な島のムードが感じられそう。気ままなリゾートライフを思わせる、オーセンティックなデザインで、快適な履き心地を提供するテキスタイルライニングとラバーアウトソールを合わせている。ラクなスタイルでのんびりアドベンチャーを楽しむときに履きたいシューズ。,"['レギュラーフィット', 'シューレースクロージャー', 'スエードアッパー', 'テキスタイルライニング', 'ラバーアウトソール', '商品番号：IG6195', '色：タクティルスティール/ダークマリーン/チョークブルー']",,,,,,,
サンバ OG メイドイン ITALY / SAMBA OG MADE IN ITALY,"55,000",ID2864,オリジナルス,"['https://shop.adidas.jp/photo/ID/ID2864/z-ID2864-standard-side_lateral_center_view-xjKkJarPLs.jpg', 'https://shop.adidas.jp/photo/ID/ID2864/z-ID2864-standard-top_portrait_view-oFrrZQxw1G.jpg', 'https://shop.adidas.jp/photo/ID/ID2864/z-ID2864-standard-bottom_view-hJmrb3Bubj.jpg', 'https://shop.adidas.jp/photo/ID/ID2864/z-ID2864-standard-front_lateral_top_view-rMXeDYSQS5.jpg', 'https://shop.adidas.jp/photo/ID/ID2864/z-ID2864-standard-back_lateral_top_view-2ft930LNSf.jpg', 'https://shop.adidas.jp/photo/ID/ID2864/z-ID2864-standard-side_medial_center_view-55yNxjCm59.jpg', 'https://shop.adidas.jp/static/images/tools/itemCard_dummy.jpg', 'https://shop.adidas.jp/static/images/tools/itemCard_dummy.jpg', 'https://shop.adidas.jp/static/images/tools/itemCard_dummy.jpg', 'https://shop.adidas.jp/static/images/tools/itemCard_dummy.jpg']",https://shop.adidas.jp/products/ID2864/,,,"['ユニセックス', 'シューズ・靴', 'スニーカー', 'オリジナルス', 'サンバ', 'サンバ OG メイドイン Italy / Samba OG Made In Italy']",イタリアから届いた上質なレザーを使ったサンバ。,歴史に裏打ちされたデザインを、長く使えるように耐久性を強化。1950年代から、アディダスブランドのオーセンティックなシューズの代表格として人気を博してきたサンバ。今回は、最高峰のクラフトマンシップが息づくイタリアで丹念に作られたモデルをリリース。滑らかなアッパーには、イタリアの皮革材料サプライヤーから調達した、イタリアのドレスシューズをヒントにしたレザーを採用。ピッチからストリートに出て久しいシューズだが、ラバーアウトソールは健在。このシューズを履いて、レジェンドたちの足跡を辿ろう。,"['レギュラーフィット', 'シューレースクロージャー', 'レザーアッパー', 'レザーライニング', 'ラバーアウトソール', '商品番号：ID2864', '色：コアブラック/コアホワイト/ガム']",,,,,,,
YEEZY BOOST 350 V2,"31,900",IF3219,オリジナルス,"['https://shop.adidas.jp/photo/IF/IF3219/z-IF3219-standard-side_lateral_center_view-g45ustGlVc.jpg', 'https://shop.adidas.jp/photo/IF/IF3219/z-IF3219-standard-front_view-uLtzHSWlCr.jpg', 'https://shop.adidas.jp/photo/IF/IF3219/z-IF3219-on_model-front_view-mMDckQMWa2.jpg', 'https://shop.adidas.jp/photo/IF/IF3219/z-IF3219-standard-top_portrait_view-6lfTKth5CL.jpg', 'https://shop.adidas.jp/photo/IF/IF3219/z-IF3219-standard-bottom_view-KnxqZqZocK.jpg', 'https://shop.adidas.jp/photo/IF/IF3219/z-IF3219-standard-left_side_center_lateral_view-DGwwiCKn0W.jpg']",https://shop.adidas.jp/products/IF3219/,"['22.0cm', '22.5cm', '23.0cm', '23.5cm', '24.0cm', '24.5cm', '25.0cm', '25.5cm', '26.0cm', '26.5cm', '27.0cm', '27.5cm', '28.0cm', '28.5cm', '29.0cm', '29.5cm', '30.0cm', '30.5cm', '31.0cm']",,"['メンズ', 'シューズ・靴', 'スニーカー', 'オリジナルス', 'YEEZY BOOST 350 V2']",,,"['合成繊維/Allocation/ゴム底', '商品番号：IF3219', '色：STEEL GREY/STEEL GREY/STEEL GREY', '生産国：India']",,,,,,,
スーパースター / SUPERSTAR,"10,890",EG4959,オリジナルス,"['https://shop.adidas.jp/photo/EG/EG4959/z-EG4959-standard-side_lateral_center_view.jpg', 'https://shop.adidas.jp/photo/EG/EG4959/z-EG4959-71-h8QGOeyAyh.jpg', 'https://shop.adidas.jp/photo/EG/EG4959/z-EG4959-72-VFeWQyqvKZ.jpg', 'https://shop.adidas.jp/photo/EG/EG4959/z-EG4959-73-uUjWbA8DyS.jpg', 'https://shop.adidas.jp/photo/EG/EG4959/z-EG4959-standard-top_portrait_view.jpg', 'https://shop.adidas.jp/photo/EG/EG4959/z-EG4959-standard-bottom_view.jpg', 'https://shop.adidas.jp/static/images/tools/itemCard_dummy.jpg', 'https://shop.adidas.jp/static/images/tools/itemCard_dummy.jpg', 'https://shop.adidas.jp/static/images/tools/itemCard_dummy.jpg', 'https://shop.adidas.jp/static/images/tools/itemCard_dummy.jpg', 'https://shop.adidas.jp/static/images/tools/itemCard_dummy.jpg', 'https://shop.adidas.jp/static/images/tools/itemCard_dummy.jpg', 'https://shop.adidas.jp/static/images/tools/itemCard_dummy.jpg', 'https://shop.adidas.jp/static/images/tools/itemCard_dummy.jpg']",https://shop.adidas.jp/products/EG4959/,"['22.0cm', '22.5cm', '23.0cm', '23.5cm', '24.0cm', '24.5cm', '25.0cm', '25.5cm', '26.0cm', '26.5cm', '27.0cm', '27.5cm', '28.0cm', '28.5cm', '29.0cm', '29.5cm', '30.0cm', '30.5cm', '31.0cm', '31.5cm', '32.0cm', '32.5cm', '33.5cm', '34.5cm']","['小さめ', '適切', '大きめ']","['ユニセックス', 'シューズ・靴', 'スニーカー', 'オリジナルス', 'スーパースター', 'スーパースター / Superstar']",,バスケットボールシューズとして誕生し、スケートボーディングやヒップホップシーンで人気を集めたスーパースター。バスケットコートを飛び出し、ゲームチェンジャーとなった一足。,"['シューレースクロージャー', 'レザーアッパー', 'アイコニックなレザーシューズ', 'ラバーアウトソール', '商品番号：EG4959', '色：コアブラック/フットウェアホワイト/コアブラック', '生産国：China,Indonesia']",,,"['4.7 / 5', '5 / 5', '5 / 5', '5 / 5', '4 / 5', '5 / 5', '5 / 5', '5 / 5', '4 / 5', '4 / 5', '5 / 5']","['', 'サイズ感について', '', '', '伝統のスーパースター', '', '', '', '', '', 'サイズ感', '', '', '永久定番', '', '', 'スーパースター一択', '', '', 'スタンスミスと同じく気に入ってます', '', '', '小6の息子に', '', '', '久しぶりのスーパースター', '', '', '定番', '']","['', '2023年10月16日', '', '', '2023年12月31日', '', '', '2022年5月3日', '', '', '2023年9月22日', '', '', '2022年5月11日', '', '', '2022年6月9日', '', '', '2021年1月1日', '', '', '2024年1月8日', '', '', '2022年9月25日', '', '', '2021年6月8日', '']","['色々なレビューでタイトすぎるから「ワンサイズ大きめを買った方がいい」という言葉を見るが、丁度のサイズを履いてみたら全く気にならなかったので、ワンサイズ大きくする必要はないと感じた。', '履いていてやはり安心感があります。そしてどんなファッションにも合わせやすい。カラーバリーエーションも豊富で、たくさん欲しくなってしまいます。まずは定番の黒で！', '定番のスーパースターでありますが、天然皮革であり、使いこなせばこなすほどにフィット感が増してくることに、ある種の喜びを感じます。手入れを怠らず永津付きあっていきたいと思います。', 'サイズ感に関しては他の方も言っている通り少しタイトだったので次からは0.5upサイズで購入しようと思いました。\n履き心地は並ですが、デザインに関しては洗練されており素晴らしいです。', 'ファッションにおけるアディダスの地位を確立した、定番中の定番。どんなスタイルにも合いますので、少し気分が離れてもまた履きたくなる魅力があります。', '主人用に。私はスタンスミス派ですが彼は幅広、甲高の足なのでスーパースターがしっくりくるそう。\nボロボロになったら新しいのにするのでセール中に購入しときます。', '三本ラインがadidasを特徴付けていて、あとは色の配色違いだけでほとんど選べるので、気分ではきかえています。スタンスミスも長年愛用してましが、こちらもアイテムとしては必ずもってます。', '普段はアシックスのスニーカーやサッカーのトレシューでジュニアサイズの24.5cmを履いていますが、これは大人サイズで24cmを購入。それでも余裕があり成長も考慮すると良いサイズ感だと思います。', 'スタンスミスの28.0cm を履いているけどスーパースターがセールで在庫が28.5cmしかなかったので購入。やはり28.0cmにすればよかったかも。\n0.5cmを甘く見てしまった。 厚手の靴下で何とか対応しよう。', '初めて買った時から5年経ちましたが、未だに同じモデル、カラーで買い直して履いています。それくらいシンプルでかっこよくて、合わせやすいです。']","['', 'Gelmai', 'Gelmai', '', '', 'tm7tm77', 'tm7tm77', '', '', 'yasuyasu', 'yasuyasu', '', '', 'CSantenna', 'CSantenna', '', '', 'Dandan', 'Dandan', '', '', 'puu6', 'puu6', '', '', 'KI1220', 'KI1220', '', '', 'haru', 'haru', '', '', 'tttyyy23', 'tttyyy23', '', '', 'Zuma', 'Zuma', '']"
サンバ OG / SAMBA OG,"15,400",B75806,オリジナルス,"['https://shop.adidas.jp/photo/B7/B75806/z-B75806-standard-side_lateral_center_view.jpg', 'https://shop.adidas.jp/photo/B7/B75806/z-B75806-standard-top_portrait_view.jpg', 'https://shop.adidas.jp/photo/B7/B75806/z-B75806-standard-bottom_view.jpg', 'https://shop.adidas.jp/photo/B7/B75806/z-B75806-standard-front_lateral_top_view.jpg', 'https://shop.adidas.jp/photo/B7/B75806/z-B75806-standard-back_lateral_top_view.jpg', 'https://shop.adidas.jp/photo/B7/B75806/z-B75806-standard-side_medial_center_view.jpg', 'https://shop.adidas.jp/static/images/tools/itemCard_dummy.jpg', 'https://shop.adidas.jp/static/images/tools/itemCard_dummy.jpg', 'https://shop.adidas.jp/static/images/tools/itemCard_dummy.jpg', 'https://shop.adidas.jp/static/images/tools/itemCard_dummy.jpg', 'https://shop.adidas.jp/static/images/tools/itemCard_dummy.jpg']",https://shop.adidas.jp/products/B75806/,,,"['ユニセックス', 'シューズ・靴', 'スニーカー', 'オリジナルス', 'サンバ', 'サンバ OG / SAMBA OG']",,フットボールのピッチからストリートへ。オリジナルのシルエットを忠実に受け継いだ、薄くソフトなレザーアッパー、スエードオーバレイ、そしてラバーソールという品のあるルックは、幅広い世代に愛されている。,"['レギュラーフィット', 'シューレースクロージャー', 'フルグレインレザーアッパーにざらっとした質感のスエードオーバーレイ / ゴールドフォイルのディテール', '合成レザーライニング / ガムラバーカップソール', 'ガムラバーミッドソール', '商品番号：B75806', '色：フットウェアホワイト/コアブラック/クリアグラナイト', '生産国：Cambodia,China,Vietnam']",,,"['4.7 / 5', '5 / 5', '5 / 5', '4 / 5', '5 / 5', '5 / 5', '5 / 5', '4 / 5', '4 / 5', '5 / 5', '5 / 5']","['', '', '', '', 'ゴルフ用も持ってる！！', '', '', '白がかわいい！', '', '', '素晴らしい', '', '', 'デザインも形も履き心地も良い', '', '', '', '', '', 'レザー部', '', '', '', '', '', 'SAMBA種類', '', '', 'サンバの中で一番のお気に入りです!', '']","['', '2023年10月30日', '', '', '2024年1月25日', '', '', '2024年1月6日', '', '', '2024年2月4日', '', '', '2024年1月27日', '', '', '2018年11月13日', '', '', '2023年9月3日', '', '', '2023年12月26日', '', '', '2023年5月16日', '', '', '2023年12月29日', '']","['同サイズガゼルを持っているが、サンバの方が作りが小さく感じました。若干窮屈に感じるため通常より0.5センチアップでも良いかもと思いました。', '昔から履いていてソールが駄目になったら買い替えしてるのですが、最近は買おうと思ったタイミングでOGが簡単に手に入らなくなってるので見つけたら買う様にしています！', '初めてのサンバです。白いスニーカーがほしくて店舗で購入。試着したところ、スタンスミスと同じ24.0cmで大丈夫でした。素材が柔らかいので細身だけど気になりません。ただ、長時間歩くとかかと（アキレス腱）が擦れてしまって…中敷きなど入れて対応してます。でも、かわいいのでたくさん履いてかわいがってあげようとおもいます！', '白黒両方買いました。\n見た目・履き心地ともに素晴らしいです。\n柔らかくすぐ馴染みます。\n経年変化によって表情が変わるのも非常に楽しみです。', 'ちょっとアンティークチックな色合いがとても可愛いです。\n似たような色合いのスペツィアル(IE3698)を買いそびれて探してたところこの色合いを見つけて迷わず購入しました。\nサイズは大人気の白黒サンバと同じでハーフサイズアップでちょうど良かったです。\nサンバはこれで3足目です。\nシューレースが2本ついていて紐を白の方にすればシンプルな感じで使えます。\nたくさん履きます。', '何度もお世話になっている一足です。\nクラシックなこのデザインが、とても魅力的かと思います。 履いた時は、若干幅が狭いと思いますが、履いてるうちに革が、自分の足に馴染んでくれます。 全体なシルエットもよく、足を包み込むような履き心地なのでオススメです。', '実物を見ずに購入したが、思った以上に皮の質感が良かったので丁寧に履き続けようと思う。\n緑ラインもありですね！', '他のサンバを購入したので、その時と同じサイズにしたのですが、こちらは1cmほど小さいサイズがちょうど良かったです。', '', '', 'サイズもバッチリで履き心地も最高です!\nそして何より最高なのが、ブラウンと黄色の組み合わせです。どちらも品があってかわいいです！\nみんなにおすすめしたい一品です！']","['', 'rara', 'rara', '', '', 'Yoshi7', 'Yoshi7', '', '', 'mayuko', 'mayuko', '', '', 'ITOPPI', 'ITOPPI', '', '', 'meerkat', 'meerkat', '', '', 'alk3', 'alk3', '', '', '', '', '', 'gromdogjc75', 'gromdogjc75', '', '', 'Kazu', 'Kazu', '', '', 'kazoo', 'kazoo', '', '', 'sambaman', 'sambaman', '']"
