coordinated_product_name,pricing,product_number,category,image_urls,product_page_url,available_sizes,sense_of_the_sizes,breadcrumbs,product_title,product_generation_description,product_itemization_generation_descriptions,table_first_column_contents,table_all_row_contents,review_stars,review_titles,review_dates,review_descriptions,review_nicknames
アディカラー クラシックス ファイヤーバード トラックトップ（ジャージ）,"10,890",IU0762,オリジナルス,"['https://shop.adidas.jp/photo/IU/IU0762/z-IU0762-on_model-standard_view-vAR87Q9Hyw.jpg', 'https://shop.adidas.jp/photo/IU/IU0762/z-IU0762-on_model-back_view-izieoSuRJi.jpg', 'https://shop.adidas.jp/photo/IU/IU0762/z-IU0762-on_model-walking_view-pfPrZXN6w3.jpg', 'https://shop.adidas.jp/photo/IU/IU0762/z-IU0762-3d_torso-front_center_view-LGZaFn1UBU.jpg', 'https://shop.adidas.jp/photo/IU/IU0762/z-IU0762-on_model-detail_view_1-hHX9MmYY5n.jpg', 'https://shop.adidas.jp/photo/IU/IU0762/z-IU0762-on_model-detail_view_2-Jag1Df9PuL.jpg']",https://shop.adidas.jp/products/IU0762/,"['XS', 'S', 'M', 'L', 'XL', '2XL', '3XL']","['小さめ', '適切', '大きめ']","['メンズ', 'ウェア・服', 'トップス', 'ジャージ', 'オリジナルス', 'ファイヤーバード', 'アディカラー クラシック', 'アディカラー クラシックス ファイヤーバード トラックトップ（ジャージ）']",リサイクル&再生可能素材を組み合わせた、トラックトップ。,"クラシックなトラックトップが、アディカラーコレクションに。ワードローブに欠かせない、お馴染みのアイコニックなファイヤーバードが、今季はモダンなカッティングと新鮮な色使いで登場。胸にトレフォイルロゴ刺しゅう、袖にスリーストライプスをあしらった、アディダスのDNAを受け継ぐデザイン。エッジーで堂々としたオーラを漂わせるスタンドカラーを立てて、颯爽と出かけよう。大切な小物をしまえるジップポケットと、手首に気持ち良くフィットするリブカフが付いている。どのカラーを選ぶ？

カーボンフットプリントを認識する：
製品のカーボンフットプリントの算定方法はライフサイクルの全ステージを考慮しており、アディダスのプロトタイプのサイズに基づいています。原料抽出から、加工、生産と製品組立、包装、輸送、使用、製品寿命に至るまでのカーボンフットプリント（CO2e）を算定しました。これは国際規格「ISO 14067」に基づいています。

製品カーボンフットプリント総量の内訳とその算定方法を確認するには、下記のリンクをコピーしてお使いのブラウザで検索してください。https://www.adidas.com/go/campaign/carbon-footprint","['ルーズフィット', 'フルジップ / スタンドカラー', 'ポリエステル100％（トリコット）', 'ジップポケット', 'リブ仕上げの裾と袖口', '商品番号：IU0762', '色：グリーン', '生産国：Pakistan']","['', '胸囲', 'うしろ着丈', '袖丈', '袖口幅']","['XS', 'S', 'M', 'L', 'XL', '2XL', '3XL', '111cm', '114cm', '119cm', '121cm', '126cm', '132cm', '139cm', '66cm', '67cm', '68cm', '68cm', '69cm', '71cm', '72cm', '63cm', '63cm', '63cm', '63cm', '63cm', '63cm', '63cm', '19cm', '19cm', '20cm', '20cm', '20cm', '20cm', '21cm']",,"['', 'ちょうどいい', '', '', '色合いが良い', '', '', 'マルーンを購入', '', '', '', '', '', '定番のジャージ', '', '', '普遍の定番スタイル', '', '', '袖丈短いかな', '', '', '原色に近い青', '', '', 'カラーが気に入り買った。', '', '', 'デザインが気に入り購入', '']","['', '2023年9月13日', '', '', '2024年3月2日', '', '', '2023年8月15日', '', '', '2024年1月22日', '', '', '2024年2月16日', '', '', '2023年6月30日', '', '', '2023年11月22日', '', '', '2023年7月15日', '', '', '2023年11月19日', '', '', '2023年10月9日', '']","['サイズ選択が難しかったけど、今回はイメージ通りで良かった。\nモデルさんのスリーサイズと着用サイズの記載があると参考にしやすいと思います。', 'ダークブルーということですが、イメージしていたよりは明るめの色合いで気に入りました。177cm腕が長めの体形でXLを購入しましたが、袖の長さは余裕があります。', '秋っぽい色が欲しくて注文させて頂きました。届いた実物は期待どおりで、明るすぎず肌触りも良くてとても気に入っております。', '165センチ52キロの息子へのプレゼントで買いました。\nピタッとした感じではなく少しダボっとした感じがいいようで思っていたとおりのようでした。\nとても気に入っています。', '一昨年購入したSSTのトラックジャケットと比較すると、サイズ感はゆったり目で生地は若干薄く感じられる。デザインはとても良い。', '普遍の定番スタイルで長く愛用できそうです。\n当方身長181、体重80キロ、肩幅48cm\n3XL購入しました。\nゆったりめで自分としては最適のサイズ感です。', 'T186cm W90kg 肩幅広 黒購入\nタイト感ややある 袖丈はあと3cm欲しい 腕白3本ラインが鮮やか 満足度☆☆☆☆★ 価格は高い…', '私の端末の影響か商品写真では水色に近く見えますが実際は原色に近い真っ青です。スタイリングの写真の色が近いと思います。自転車が青なのでスポーツの移動時用に買いました。記事はやや目が詰まっている印象なので秋冬春の使用がいいと思います。', 'セール対象外の商品でしたが以前から気になってました。一目惚れで買って！カラーもデザインもスタイルも大好きなアディダスコレクション！', '話題のトラックジャケットとして購入を決めました。180cm83kgで2XLを選択しました。丈感と袖丈はジャストサイズで胸囲は少し余裕がある感じです。若干裏起毛な感じがして秋から初冬、春に活躍出来ると思います。']","['', 'motchan', 'motchan', '', '', 'metaboga', 'metaboga', '', '', 'ib36', 'ib36', '', '', 'banbi', 'banbi', '', '', 'KAZU', 'KAZU', '', '', 'jack26', 'jack26', '', '', 'QchanTMAX', 'QchanTMAX', '', '', 'messiah', 'messiah', '', '', 'Tony888', 'Tony888', '', '', 'shinno130', 'shinno130', '']"
SST トラックトップ（ジャージ）,"14,300",IS1403,オリジナルス,"['https://shop.adidas.jp/photo/IS/IS1403/z-IS1403-on_model-standard_view-HQIpf8xGPl.jpg', 'https://shop.adidas.jp/photo/IS/IS1403/z-IS1403-on_model-back_view-EPWJiOjmFG.jpg', 'https://shop.adidas.jp/photo/IS/IS1403/z-IS1403-on_model-walking_view-ZyTlooavvZ.jpg', 'https://shop.adidas.jp/photo/IS/IS1403/z-IS1403-3d_torso-front_center_view-tMZr6NJa5H.jpg', 'https://shop.adidas.jp/photo/IS/IS1403/z-IS1403-on_model-detail_view_1-uKU4rIwZSz.jpg', 'https://shop.adidas.jp/photo/IS/IS1403/z-IS1403-on_model-detail_view_2-CN2ZDbKMxx.jpg']",https://shop.adidas.jp/products/IS1403/,"['XS', 'S', 'M', 'L', 'XL', '2XL', '3XL']",,"['メンズ', 'ウェア・服', 'トップス', 'ジャージ', 'オリジナルス', 'SST トラックトップ（ジャージ）']",リサイクル素材を一部使用した、カラーブロック トラックトップ。,"ルーツはスポーツにありながら現代向けにリメイクされた、アディダスの真のアイデンティティともいえるトラックトップ。アディダスのアーカイブに眠るアイコニックなスタイルを、スリムなカッティング、ジップポケット、リブ仕上げの袖でモダンに一新している。フロントのトレフォイル刺しゅうが、自分自身の道を切り開く過程で伝説的なクリエイターたちとのつながりを感じさせてくれる。家でくつろぐときや、夜の外出にも羽織れる、ヘビロテ間違いなしの一着。

この製品には、リサイクル素材を70%以上使用。製造された製品の素材をリユースすることで、ゴミの量、限りある資源への依存、そしてアディダス製品のフットプリントを減らすことにつながる。","['スリムフィット', 'フルジップ / リブ仕上げのボンバー襟', 'ポリエステル100％（トリコット）', '両サイドにジップポケット', 'リブ仕上げの袖口と裾', '商品番号：IS1403', '色：ワンダーホワイト/カレッジグリーン']","['', '胸囲', 'うしろ着丈', '袖丈', '袖口幅']","['XS', 'S', 'M', 'L', 'XL', '2XL', '3XL', '95cm', '98cm', '103cm', '105cm', '110cm', '116cm', '123cm', '64cm', '65cm', '66cm', '66cm', '67cm', '69cm', '70cm', '77cm', '77cm', '78cm', '78cm', '78cm', '79cm', '79cm', '19cm', '19cm', '20cm', '20cm', '20cm', '20cm', '21cm']","['5 / 5', '5 / 5', '5 / 5', '5 / 5']","['', '色合い風合い最高です。', '', '', 'シブいですね', '', '', '色味が良い。', '']","['', '2024年2月15日', '', '', '2024年3月1日', '', '', '2024年2月27日', '']","['アース系の色合い、薄すぎず厚すぎず、共に最高です。\n是非ともパンツとのセットアップで着用されることをお薦めします。', '173/61でLサイズ購入しました。ピッタリ着たいのでジャストです！色はアースストレータ。\nいつもは襟付き（主にベッケンバウアー）が好きですけど、あまりにも色がかっこよくてシブくて\nたまらず購入してました。\nSSTもいいですねー', '', '']","['', 'lij0104', 'lij0104', '', '', 'aoao', 'aoao', '', '', 'nickname', 'nickname', '']"
アディカラー クラシックス スリーストライプス パーカー,"8,536",IL2490,オリジナルス,"['https://shop.adidas.jp/photo/IL/IL2490/z-IL2490-on_model-standard_view-Yj4LQxgQaF.jpg', 'https://shop.adidas.jp/photo/IL/IL2490/z-IL2490-on_model-back_view-LCHckN1uPs.jpg', 'https://shop.adidas.jp/photo/IL/IL2490/z-IL2490-on_model-walking_view-GHVScmUQNx.jpg', 'https://shop.adidas.jp/photo/IL/IL2490/z-IL2490-3d_torso-front_center_view-TO79IS4PKz.jpg', 'https://shop.adidas.jp/photo/IL/IL2490/z-IL2490-on_model-detail_view_1-BlHgViNmxp.jpg', 'https://shop.adidas.jp/photo/IL/IL2490/z-IL2490-on_model-detail_view_2-VEbRdzuURn.jpg']",https://shop.adidas.jp/products/IL2490/,"['XS', 'S', 'M', 'L', 'XL', '2XL', '3XL']",,"['メンズ', 'ウェア・服', 'トップス', 'パーカー(フーディー)', 'オリジナルス', 'アディカラー', 'アディカラー クラシック', 'アディカラー クラシックス スリーストライプス パーカー']",アイコニックなトレフォイルロゴをあしらった、定番パーカー。,"アーカイブのアイコニックなルックスを踏襲した、アディダス アディカラー クラシックス スリーストライプス パーカー。ソフトなフリースファブリックを使用してリラックスフィットに仕上げた、タイムレスなデザインのデイリーカジュアルウェア。刺しゅうのトレフォイルロゴと両袖にあしらったスリーストライプスが、クラシックなアクセントになっている。

アディダスは、持続可能な綿花栽培の普及を目指すベターコットンと提携。ベターコットンは、綿花生産者への待遇や綿花の生育環境を改善して、このセクターの将来の繁栄を目指して取り組んでいる。

「マスバランス」と呼ばれる生産物流管理モデルを通じて供給されている。最終製品までの過程を物理的に辿ることはできないが、ベターコットン農家は、私たちが「調達」するのと同等量の利益を得ている。

詳細はこちら：bettercotton.org/learnmore","['レギュラーフィット', 'ドローコード付きフード', '綿70% / ポリエステル30%（フリース［裏起毛］）', 'カンガルーポケット', 'リブ仕上げの裾と袖口', 'ベターコットンを使用', '商品番号：IL2490', '色：ワンダーベージュ']","['', '胸囲', 'うしろ着丈', 'フード長さ', '袖丈']","['XS', 'S', 'M', 'L', 'XL', '2XL', '3XL', '99cm', '102cm', '107cm', '109cm', '114cm', '120cm', '127cm', '64cm', '65cm', '66cm', '66cm', '67cm', '69cm', '70cm', '53cm', '54cm', '54cm', '54cm', '55cm', '56cm', '56cm', '65cm', '65cm', '65cm', '65cm', '65cm', '65cm', '65cm']","['4.5 / 5', '3 / 5', '5 / 5', '5 / 5', '5 / 5']","['', 'ちょっとタイト', '', '', 'ADIDASの3本LINEに、温かいパーカーがお気に入り✨✨', '', '', '遂に手に入れれた', '', '', '色合いがとてもいい', '']","['', '2023年10月29日', '', '', '2024年2月5日', '', '', '2023年12月9日', '', '', '2024年2月9日', '']","['着丈がサイズ感と違って短いと思う。\n2XLでもわりとタイト感はある。\nもう少しダボ感があったらいいなと思いました。', 'adidasの3本LINEに、お洒落に着こなせるパーカーとして購入。\n3XLサイズで、ゆとりがあって着やすいです。\n裏地が裏起毛なので、寒い日は温かく着れてお勧め。', 'HPを見たが実店舗のみが痛かった\nしかしこの度街のスポーツ店で何故か\n購入出来ました\n着心地もよく、サイズもフィット\nしっかり暖かく生地も厚すぎずで\n上にジャンバーなどを着ても\nゴワゴワしない 実に良い一着です', 'なかなか見かけない色でとても気に入りました。', 'デザインもしんぶで、着心地もよく、\nかっこいいです。']","['', 'Hoppy55', 'Hoppy55', '', '', 'shingo3324', 'shingo3324', '', '', 'jinskxp', 'jinskxp', '', '', 'adisanbon', 'adisanbon', '']"
SST トラックトップ（ジャージ）,"11,000",IS3322,オリジナルス,"['https://shop.adidas.jp/photo/IS/IS3322/z-IS3322-on_model-standard_view-uaiQhY3k5n.jpg', 'https://shop.adidas.jp/photo/IS/IS3322/z-IS3322-on_model-back_view-N6EthryUAb.jpg', 'https://shop.adidas.jp/photo/IS/IS3322/z-IS3322-on_model-walking_view-coglTQq4BZ.jpg', 'https://shop.adidas.jp/photo/IS/IS3322/z-IS3322-3d_torso-front_center_view-jwAu43MjJp.jpg', 'https://shop.adidas.jp/photo/IS/IS3322/z-IS3322-on_model-detail_view_1-pLURGpDyUo.jpg', 'https://shop.adidas.jp/photo/IS/IS3322/z-IS3322-on_model-detail_view_2-XbifNF2VVL.jpg']",https://shop.adidas.jp/products/IS3322/,"['XS', 'S', 'M', 'L', 'XL', '2XL', '3XL']",,"['メンズ', 'ウェア・服', 'トップス', 'ジャージ', 'オリジナルス', 'SST トラックトップ（ジャージ）']",リサイクル素材を一部使用した、カラーブロック トラックトップ。,"ルーツはスポーツにありながら現代向けにリメイクされた、アディダスの真のアイデンティティともいえるトラックトップ。アディダスのアーカイブに眠るアイコニックなスタイルを、スリムなカッティング、ジップポケット、リブ仕上げの袖でモダンに一新している。フロントのトレフォイル刺しゅうが、自分自身の道を切り開く過程で伝説的なクリエイターたちとのつながりを感じさせてくれる。家でくつろぐときや、夜の外出にも羽織れる、ヘビロテ間違いなしの一着。

この製品には、リサイクル素材を70%以上使用。製造された製品の素材をリユースすることで、ゴミの量、限りある資源への依存、そしてアディダス製品のフットプリントを減らすことにつながる。","['スリムフィット', 'フルジップ / リブ仕上げのボンバー襟', 'ポリエステル100％（トリコット）', '両サイドにジップポケット', 'リブ仕上げの袖口と裾', '商品番号：IS3322', '色：ワンダータープ/アースストレータ']","['', '胸囲', 'うしろ着丈', '袖丈', '袖口幅']","['XS', 'S', 'M', 'L', 'XL', '2XL', '3XL', '95cm', '98cm', '103cm', '105cm', '110cm', '116cm', '123cm', '64cm', '65cm', '66cm', '66cm', '67cm', '69cm', '70cm', '77cm', '77cm', '78cm', '78cm', '78cm', '79cm', '79cm', '19cm', '19cm', '20cm', '20cm', '20cm', '20cm', '21cm']","['5 / 5', '5 / 5', '5 / 5', '5 / 5']","['', '色合い風合い最高です。', '', '', 'シブいですね', '', '', '色味が良い。', '']","['', '2024年2月15日', '', '', '2024年3月1日', '', '', '2024年2月27日', '']","['アース系の色合い、薄すぎず厚すぎず、共に最高です。\n是非ともパンツとのセットアップで着用されることをお薦めします。', '173/61でLサイズ購入しました。ピッタリ着たいのでジャストです！色はアースストレータ。\nいつもは襟付き（主にベッケンバウアー）が好きですけど、あまりにも色がかっこよくてシブくて\nたまらず購入してました。\nSSTもいいですねー', '', '']","['', 'lij0104', 'lij0104', '', '', 'aoao', 'aoao', '', '', 'nickname', 'nickname', '']"
グラフィック モノグラム 総柄プリントシャツ,"10,890",HZ4161,オリジナルス,"['https://shop.adidas.jp/photo/HZ/HZ4161/z-HZ4161-on_model-standard_view-dxilZmCqtj.jpg', 'https://shop.adidas.jp/photo/HZ/HZ4161/z-HZ4161-on_model-back_view-DDFAuHefeo.jpg', 'https://shop.adidas.jp/photo/HZ/HZ4161/z-HZ4161-on_model-walking_view-iaEd0fUUMU.jpg', 'https://shop.adidas.jp/photo/HZ/HZ4161/z-HZ4161-3d_torso-front_center_view-txsZ1lKw9Y.jpg', 'https://shop.adidas.jp/photo/HZ/HZ4161/z-HZ4161-on_model-detail_view_1-WrpuD7WxkU.jpg', 'https://shop.adidas.jp/photo/HZ/HZ4161/z-HZ4161-on_model-detail_view_2-HQrchoZYI0.jpg']",https://shop.adidas.jp/products/HZ4161/,"['XS', 'S', 'M', 'L', 'XL', '2XL', '3XL']","['小さめ', '適切', '大きめ']","['メンズ', 'ウェア・服', 'トップス', 'シャツ', 'オリジナルス', 'グラフィック モノグラム 総柄プリントシャツ']",トレフォイルのモノグラムプリントが映える、リラックスムードのシャツ。,"個性を主張できる、総柄プリントシャツ。全体にトレフォイル モノグラムパターンをあしらい、色はワントーンでまとめ、スポーティーさとプレッピーな雰囲気をバランス良く配合。近所はもちろん、バーベキューに着て行くのもぴったり。一日中快適な着心地が続く、ソフトなコットン製。

サステナブルな綿花栽培をサポートしている、アディダスのコットン製品。","['ルーズフィット', 'フルボタンのフロント / 折り襟', '綿100%（平織り）', '前にポケット', 'ベターコットンを使用', '商品番号：HZ4161', '色：イージーグリーン']","['', '胸囲', 'うしろ着丈', '袖丈']","['XS', 'S', 'M', 'L', 'XL', '2XL', '3XL', '93cm', '96cm', '101cm', '103cm', '108cm', '114cm', '121cm', '71cm', '72cm', '73cm', '73cm', '74cm', '76cm', '77cm', '27cm', '28cm', '28cm', '28cm', '29cm', '30cm', '32cm']","['4.2 / 5', '3 / 5', '4 / 5', '4 / 5', '5 / 5', '5 / 5']","['', '爽やかな発色', '', '', '暖かくなるこれからの時期に期待', '', '', 'ロゴが全体に', '', '', '', '', '', 'もうワンサイズ', '']","['', '2024年1月18日', '', '', '2024年2月23日', '', '', '2023年5月17日', '', '', '2024年1月22日', '', '', '2023年5月24日', '']","['前開きボタンのシャツを探していて見つけました。実物は爽やかな黄緑という印象。遠目にはトレフォイルは目立たず無地に見えると思います。個人的には長袖シャツの展開を増やしてほしいです。', '想像通りの商品でした。\nこれから暖かくなるので着るのが楽しみです。\nお安く買えて良かったです(^_^)/', 'グリーンを、購入。\nロゴが全体的にあり夏用としては最適ですが\nLサイズよりももうワンサイズ大きなサイズを\n購入した方がよかったかな。', 'トレフォイルロゴ好きにはもってこいの商品です。シャツ一面のロゴはとても目立ちます。同系色のハーフパンツを合わせて着ようと思います。', 'もうワンサイズ大きなサイズを\n選べばよかったかなー。\nそしたらゆったりきれたかも。\n返品するまででもないので\n夏活躍するでしょう。']","['', 'tecchan', 'tecchan', '', '', 'Matsu', 'Matsu', '', '', 'DDT8', 'DDT8', '', '', 'Kiyomiya38', 'Kiyomiya38', '', '', 'ufei05', 'ufei05', '']"
SST ボンデッドトラックトップ（ジャージ）,"15,400",IM9883,オリジナルス,"['https://shop.adidas.jp/photo/IM/IM9883/z-IM9883-on_model-standard_view-AczCR59huU.jpg', 'https://shop.adidas.jp/photo/IM/IM9883/z-IM9883-71-bjPpaFADHn.jpg', 'https://shop.adidas.jp/photo/IM/IM9883/z-IM9883-72-K8hGnZKhZF.jpg', 'https://shop.adidas.jp/photo/IM/IM9883/z-IM9883-73-dFtiuUUQDk.jpg', 'https://shop.adidas.jp/photo/IM/IM9883/z-IM9883-on_model-back_view-x6rvxUH7Su.jpg', 'https://shop.adidas.jp/photo/IM/IM9883/z-IM9883-on_model-walking_view-zKRPS2ets9.jpg', 'https://shop.adidas.jp/static/images/tools/itemCard_dummy.jpg', 'https://shop.adidas.jp/static/images/tools/itemCard_dummy.jpg', 'https://shop.adidas.jp/static/images/tools/itemCard_dummy.jpg']",https://shop.adidas.jp/products/IM9883/,"['XS', 'S', 'M', 'L', 'XL', '2XL', '3XL']",,"['メンズ', 'ウェア・服', 'トップス', 'ジャージ', 'オリジナルス', 'SST ボンデッドトラックトップ（ジャージ）']",アディダスのDNAを受け継ぐ、ミニマルなデザインのトラックトップ。,ただのトラックトップではない。これはアディダスのスポーツの伝統を受け継ぐスリムカットバージョン。家でくつろぐときも、街に出かけるときも、貴重品をきちんとしまっておけるジップポケットを備えているから、一日中快適に過ごせる。ソフトなプレーンウィーブ素材を使用した、生涯アクティブなライフスタイルを送りたい人のための動きやすい一着。,"['スリムフィット', 'フルジップ / リブ仕上げのボンバー襟', 'ポリエステル100%（プレーンウィーブ）', '両サイドにジップポケット', '伸縮性のある袖口と裾', '商品番号：IM9883', '色：ブラック', '生産国：Cambodia']","['', '胸囲', 'うしろ着丈', '袖丈', '袖口幅']","['XS', 'S', 'M', 'L', 'XL', '2XL', '3XL', '95cm', '98cm', '103cm', '105cm', '110cm', '116cm', '123cm', '64cm', '65cm', '66cm', '66cm', '67cm', '69cm', '70cm', '77cm', '77cm', '78cm', '78cm', '78cm', '79cm', '79cm', '21cm', '21cm', '22cm', '22cm', '22cm', '22cm', '23cm']","['5 / 5', '5 / 5']","['', 'クールです', '']","['', '2024年2月9日', '']",['とにかくかっこいいです。勝利の三本線もブラックなのでさり気なくて大人っぽいです。身幅が細いので3XLにして身幅をゆったりさせて着ています。ポケットはファスナーつきなので、手ぶらで出かけられます。'],"['', 'adisuki', 'adisuki', '']"
テニス HEAT. RDY フリーリフト プロ半袖Tシャツ,"5,280",IK7112,テニス,"['https://shop.adidas.jp/photo/IK/IK7112/z-IK7112-on_model-standard_view-TD2g4jC2lP.jpg', 'https://shop.adidas.jp/photo/IK/IK7112/z-IK7112-on_model-side_view-K7Jf5Mli7v.jpg', 'https://shop.adidas.jp/photo/IK/IK7112/z-IK7112-on_model-back_view-kO3XpSc8T7.jpg', 'https://shop.adidas.jp/photo/IK/IK7112/z-IK7112-on_model-walking_view-QqTV06XbX0.jpg', 'https://shop.adidas.jp/photo/IK/IK7112/z-IK7112-3d_torso-front_center_view-Xl3co6u37t.jpg', 'https://shop.adidas.jp/static/images/tools/itemCard_dummy.jpg', 'https://shop.adidas.jp/static/images/tools/itemCard_dummy.jpg', 'https://shop.adidas.jp/static/images/tools/itemCard_dummy.jpg']",https://shop.adidas.jp/products/IK7112/,"['XS', 'S', 'M', 'L', 'XL', '2XL', '3XL']",,"['メンズ', 'テニス', 'ウェア・服', 'トップス', 'Tシャツ', 'HEAT.RDY', 'テニス HEAT. RDY フリーリフト プロ半袖Tシャツ']",リサイクル素材を使用した、挑戦者にふさわしいスリムフィットTシャツ。,"女子テニス協会の設立および、男女差別が残っていた時代のテニス界の象徴的事件、""Battle of the Sexes（性別間の争い）""から50年が経った今、現状を打破することで得られる恩恵を讃えるものとして生まれた、スリムフィットのアディダスTシャツ。テニス界でのあらゆる困難に立ち向かうためにデザインされた、ひときわ目を引く総柄プリントが特徴。サーブやスマッシュの動きを妨げないフリーリフトのデザイン。涼しく、爽やかな着心地をもたらすHEAT. RDYでコートの主役になろう。

プラスチックゴミ ゼロを目指すアディダスの取り組みの一つをカタチにした、100%リサイクル素材で作られたアイテム。","['スリムフィット', 'クルーネック', 'ポリエステル100%（ダブルニット）', 'HEAT. RDY', 'フリーリフトデザイン', '脇下にメッシュインサート', 'ドロップテールの裾', '商品番号：IK7112', '色：ブラック']","['', '胸囲', 'うしろ着丈', '袖丈']","['S', 'M', 'L', 'XL', '2XL', '3XL', '93cm', '98cm', '100cm', '105cm', '111cm', '118cm', '71cm', '72cm', '72cm', '73cm', '75cm', '76cm', '21cm', '22cm', '22cm', '23cm', '24cm', '25cm']",,,,,
